{
  "conversation_id": "conversation_01",
  "organization_id": "org_01",
  "project_id": "project_01",
  "summary": "品牌：示例品牌；目标：提升试用转化；受众：效率工具用户",
  "summary_kind": "deterministic",
  "summary_content_hash": "sha256:cccccccccccccccccccccccccccccccccccccccccccccccccccccccccccccccc",
  "open_questions": ["需要确认主要投放平台"],
  "last_message_id": "message_24",
  "recent_window_start_message_id": "message_05",
  "artifact_manifest": {
    "brief_ref": {"type": "brief_draft", "id": "briefdraft_01", "version": 4, "content_hash": "sha256:aaaaaaaaaaaaaaaaaaaaaaaaaaaaaaaaaaaaaaaaaaaaaaaaaaaaaaaaaaaaaaaa"},
    "selected_source_ids": ["document_01"]
  },
  "last_compacted_at": "2026-08-10T00:00:00Z",
  "version": 7,
  "updated_at": "2026-08-10T00:00:00Z"
}
